overview,Action,Adventure,Animation,Comedy,Crime,Documentary,Drama,Family,Fantasy,Foreign,History,Horror,Music,Mystery,Romance,Science Fiction,Thriller,War,Western
"The film is set in five parts, five seasons that are part of the Chinese almanac. The story takes place in the jianghu, the world of the martial arts. Ouyang Feng has lived in the western desert for some years. He left his home in White Camel Mountain when the woman he loved chose to marry his elder brother rather than him. Instead of seeking glory, he ends up as an agent. When people come to him with a wish to eliminate someone who has wronged them, he puts them in touch with a swordsman who can do the job.",1,0,0,0,0,0,1,0,0,0,0,0,0,0,0,0,0,0,0
A film about the work of the artist most famous for her monuments such as the Vietnam Memorial Wall and the Civil Rights Fountain Memorial.,0,0,0,0,0,1,0,0,0,0,0,0,0,0,0,0,0,0,0
"""Stalingrad"" follows the progress of a German Platoon through the brutal fighting of the Battle of Stalingrad. After having half their number wiped out and after being placed under the command of a sadistic Captain, the Lieutenant of the platoon leads his men to desert. The men of the platoon attempt to escape from the city which is now surrounded by the Soviet Army.",0,0,0,0,0,0,1,0,0,0,1,0,0,0,0,0,0,1,0
The 21st successor to the role of Bengalla's resident superhero must travel to New York to prevent a rich madman from obtaining three magic skulls that would give him the secret to ultimate power.,1,1,0,0,0,0,0,0,0,0,0,0,0,0,0,0,0,0,0
"Bounced from her job, Erin Grant needs money if she's to have any chance of winning back custody of her child. But, eventually, she must confront the naked truth: to take on the system, she'll have to take it all off. Erin strips to conquer, but she faces unintended circumstances when a hound dog of a Congressman zeroes in on her and sharpens the shady tools at his fingertips, including blackmail and murder.",0,0,0,0,1,0,1,0,0,0,0,0,0,0,0,0,1,0,0
"It is 1977, Dublin rocks to the music of Thin Lizzy and the world is stunned by the death of Elvis Presley. Frankie, caught between acne and adulthood, has just completed his final exams in school. Convinced he will fail, he survives the summer organising a beach party, having lustful thoughts about two girls he believes are unobtainable and fending off the advances from a visiting American family friend, all whilst coping with his oddball family.",0,0,0,1,0,0,1,0,0,0,0,0,0,0,0,0,0,0,0
"Victor is a cook who works in a greasy bar/restaurant owned by his mother, Dolly. It's just the two of them, a waitress named Delores, and a heavy drinking regular, Leo. But things change when Callie, a beautiful college drop-out, shows up as a new waitress and steals Victor's heart. But Victor is too shy to do anything about it, and too self-consciously overweight to dream of winning Callie away.",0,0,0,0,0,0,1,0,0,0,0,0,0,0,1,0,0,0,0
"Jack Powell suffers from an affliction that makes him grow four times faster than normal, so the 10-year-old looks like a 40-year-old man. After years of being tutored at home, Jack convinces his overprotective parents to send him to public school. The children don't know what to make of Jack, but with the help of his fifth-grade teacher, he makes an effort to win them over.",0,0,0,1,0,0,1,0,0,0,0,0,0,0,0,1,0,0,0
"Based on the true story of Valerie Solanas who was a 60s radical preaching hatred toward men in her ""Scum"" manifesto. She wrote a screenplay for a film that she wanted Andy Warhol to produce, but he continued to ignore her. So she shot him. This is Valerie's story.",0,0,0,0,0,0,1,0,0,0,0,0,0,0,0,0,0,0,0
"Based on the novel by Truman Capote, this often-witty coming-of-age drama looks at a young man growing up with an unusual family in the Deep South in the 1940s.",0,0,0,1,0,0,1,1,0,0,0,0,0,0,0,0,0,0,0
"This tale takes place in a bar. The Spanish Alonso and his blind mother run this place. Bay, who is Alonso's friend live here too. This story tells something about Alonso and Bay and the ""American Dream"".",0,0,0,0,0,0,1,0,0,0,0,0,0,0,0,0,0,0,0
A young man with dreams of pursuing a career in music moves form his small village to  the capital. Along the way he falls head over heels for a woman - the same woman his boss is also pursuing for his own reasons.,0,0,0,0,0,0,0,0,0,0,0,0,1,0,1,0,0,0,0
"A cowherd with a skull-mounted motorcycle and a university student meet in Dakar; put off by life in Senegal, they plan to make money in Paris.",0,0,0,0,0,0,1,0,0,0,0,0,0,0,1,0,0,0,0
"In pre-colonial times a peddler crossing the savanna discovers a child lying unconscious in the bush. When the boy comes to, he is mute and cannot explain who he is. The peddler leaves him with a family in the nearest village. After a search for his parents, the family adopts him, giving him the name Wend Kuuni (God's Gift) and a loving sister with whom he bonds. Wend Kuuni regains his speech only after witnessing a tragic event that prompts him to reveal his own painful history.",0,0,0,0,0,0,1,0,0,0,0,0,0,0,0,0,0,0,0
"Three directors each adapt a Poe short story to the screen: ""Toby Dammit"" features a disheveled drugged and drunk English movie star who nods acceptance in the Italian press and his producers fawn over him. ""Metzengerstein"" features a Mediveal countess who has a love-hate relationship with a black stallion - who it turns out is really her dead lover. ""William Wilson"" tells the story of a sadistic Austrian student with an exact double whom he later kills.",0,0,0,0,0,0,1,0,0,0,0,1,0,1,0,0,0,0,0
"Union soldiers in search of food descend on the farm of a Confederate family and decide to stay until one in their ranks' wounds have healed. While the war weary Union captain (Chris Cooper) falls for the mother of the family (Patricia Clarkson) - whose husband is off fighting for the rebels - her son plots revenge on the dirty, double-dealing Yankees. Co-stars Kris Kristofferson.",0,0,0,0,0,0,1,0,0,0,0,0,0,0,0,0,0,1,1
"Renton, deeply immersed in the Edinburgh drug scene, tries to clean up and get out, despite the allure of the drugs and influence of friends.",0,0,0,0,1,0,1,0,0,0,0,0,0,0,0,0,0,0,0
"Two strangers, whose paths are always crossing, finally meet when fate steps in. It took them twenty years to fall in love at first sight.",0,0,0,1,0,0,0,0,0,0,0,0,0,0,1,0,0,0,0
"On July 2, a giant alien mothership enters orbit around Earth and deploys several dozen saucer-shaped 'destroyer' spacecraft that quickly lay waste to major cities around the planet. On July 3, the United States conducts a coordinated counterattack that fails. On July 4, a plan is devised to gain access to the interior of the alien mothership in space, in order to plant a nuclear missile.",1,1,0,0,0,0,0,0,0,0,0,0,0,0,0,1,0,0,0
"Lucy Harmon, an American teenager is arriving in the lush Tuscan countryside to be sculpted by a family friend who lives in a beautiful villa. Lucy visited there four years earlier and exchanged a kiss with an Italian boy with whom she hopes to become reacquainted.",0,0,0,0,0,0,1,0,0,0,0,0,0,0,1,0,0,0,0
"When the San Francisco Giants pay centerfielder Bobby Rayburn $40 million to lead their team to the World Series, no one is happier or more supportive than #1 fan Gil Renard.  So when Rayburn becomes mired in the worst slump of his career, the obsessed Renard decides to stop at nothing to help his idol regain his former glory... not even murder.",0,0,0,0,0,0,1,0,0,0,0,0,0,1,0,0,1,0,0
"When Quasi defies the evil Frollo and ventures out to the Festival of Fools, the cruel crowd jeers him. Rescued by fellow outcast the gypsy Esmeralda, Quasi soon finds himself battling to save the people and the city he loves.",0,0,1,0,0,0,1,1,0,0,0,0,0,0,0,0,0,0,0
"When recently single Steven moves into his new apartment, cable guy Chip comes to hook him up -- and doesn't let go. Initially, Chip is just overzealous in his desire to be Steven's pal, but when Steven tries to end the ""friendship,"" Chip shows his dark side. He begins stalking Steven, who's left to fend for himself because no one else can believe Chip's capable of such behavior.",0,0,0,1,0,0,1,0,0,0,0,0,0,0,0,0,1,0,0
"After bowler Roy Munson swindles the wrong crowd and is left with a hook for a hand, he settles into impoverished obscurity. That is, until he uncovers the next big thing: an Amish kid named Ishmael. So, the corrupt and the hopelessly naïve hit the circuit intent on settling an old score with Big Ern.",0,0,0,1,0,0,0,0,0,0,0,0,0,0,0,0,0,0,0
"U.S. Marshall John Kruger erases the identities of people enrolled in the Witness Protection Program. His current assignment is to protect Lee Cullen, who's uncovered evidence that the weapons manufacturer she works for has been selling to terrorist groups. When Kruger discovers that there's a corrupt agent within the program, he must guard his own life while trying to protect Lee's.",1,0,0,0,0,0,1,0,0,0,0,0,0,1,0,0,1,0,0
"The Gate of Heavenly Peace is a feature-length documentary about the 1989 protest movement, reflecting the drama, tension, humor, absurdity, heroism, and many tragedies of the six weeks from April to June in 1989. The film reveals how the hard-liners within the government marginalized moderates among the protesters (including students, workers and intellectuals), while the actions of radical protesters undermined moderates in the government. Moderate voices were gradually cowed and then silenced by extremism and emotionalism on both sides.",0,0,0,0,0,1,0,0,0,0,0,0,0,0,0,0,0,0,0
"Eddie Murphy stars as shy Dr. Sherman Klump, a kind, brilliant, 'calorifically challenged' genetic professor. When beautiful Carla Purty joins the university faculty, Sherman grows desperate to whittle his 400-pound frame down to size and win her heart. So, with one swig of his experimental fat-reducing serum, Sherman becomes 'Buddy Love', a fast-talking, pumped-up , plumped down Don Juan.",0,0,0,1,0,0,0,0,1,0,0,0,0,0,1,1,0,0,0
"A viceroy and an archbishop take their posts in Mexico. A local nun, Sor Juana Inés de la Cruz (1651-1695), intrigues them. The viceroy and his wife find her brilliant and fascinating. The prelate finds her a symbol of European laxity. He engineers the election of a new abbess, severe and ascetic. The virreina visits Sor Juana often and inspires her to write passionate poetry that the archbishop finds scandalous. The viceroy protects her. After he is replaced and returns to Spain with his wife, Sor Juana faces envy and retribution. A bishop betrays her, her confessor humbles her. Plague, a tribunal, and her confession as ""the worst of all"" end the great poet's life.",0,0,0,0,0,0,1,0,0,1,0,0,0,0,0,0,0,0,0
"In 1925 Romania, young Marie-Therese Von Debretsy refuses the flirtatious advances of her husband's commanding officer. As a result, the cosmopolitan family is reassigned to a brutally bleak and dangerous outpost on the Bulgarian/Romanian frontier where both their relationship and humanity are severely tested.",0,0,0,0,0,0,1,0,0,0,0,0,0,0,1,0,0,1,0
"Mercedes is a taxi dancer who wants to be an actress. She's involved with the married Harry, who considers himself a respected actor. Ernesto is in love with Mercedes, but he doesn't dance or have money.",0,0,0,1,0,0,1,0,0,0,0,0,0,0,0,0,0,0,0
"When David, an ex-monk still in his twenties meets Mark, he falls hard; soon he's asked Mark if they can live together. Things go well for awhile, and then differences in their definition of ""commitment"" begin to push them apart. Mark wants other sexual adventures, David tries to go along. Can they talk through the crisis in their relationship or is a breakup in the offing? David sees his relationship with Mark as a marriage, so if it ends, can David's heart ever heal?",0,0,0,0,0,0,1,0,0,0,0,0,0,0,0,0,0,0,0
La vieille qui marchait dans la mer (English: The Old Lady Who Walked in the Sea) is a 1991 French film directed by Laurent Heynemann and written by Heynemann and Dominique Roulet. It won the 1992 César Award for Best Actress.,0,0,0,1,0,0,0,0,0,0,0,0,0,0,0,0,0,0,0
A group of armed robbers fleeing the police head for the New Jersey Tunnel and run right into trucks transporting toxic waste. The spectacular explosion that follows results in both ends of the tunnel collapsing and the handful of people who survived the explosion are now in peril. Kit Latura is the only man with the skill and knowledge to lead the band of survivors out of the tunnel before the structure collapses.,1,1,0,0,0,0,0,0,0,0,0,0,0,0,0,0,1,0,0
"Once an architect, Frank Bannister now passes himself off as an exorcist of evil spirits. To bolster his facade, he claims his ""special"" gift is the result of a car accident that killed his wife. But what he does not count on is more people dying in the small town where he lives. As he tries to piece together the supernatural mystery of these killings, he falls in love with the wife of one of the victims and deals with a crazy FBI agent.",0,0,0,1,0,0,0,0,0,0,0,1,0,0,0,0,0,0,0
"When the skeleton of his murdered predecessor is found, Sheriff Sam Deeds unearths many other long-buried secrets in his Texas border town.",0,0,0,0,0,0,1,0,0,0,0,0,0,1,1,0,0,0,0
"When the secret notebook of a young girl who fancies herself a spy is found by her friends, her speculations make her very unpopular! Can she win her friends back?",0,0,0,1,0,0,1,1,0,0,0,0,0,0,0,0,0,0,0
"An ordinary man sees a bright light descend from the sky, and discovers he now has super-intelligence and telekinesis.",0,0,0,0,0,0,1,0,1,0,0,0,0,0,1,1,0,0,0
"Things have been tough lately for Amelia. Her best friend moved out of the apartment, her cat got cancer, and now her best friend, Laura, is getting married. She copes with things, from the help of Andrew, Frank, Laura, and a brief romance with Bill ""The Ugly Guy"".",0,0,0,1,0,0,1,0,0,0,0,0,0,0,1,0,0,0,0
"Mickey, a free-spirited New York cabbie, and Francis, a materialistic Wall Street stockbroker, are extremely competitive and confused about women as a result of their father's influence. Though they disagree about everything, they have one thing in common: Mickey's ex-fiance Heather is Francis's secret love. Though both brothers have beautiful wives, Heather triggers their longtime sibling rivalry",0,0,0,1,0,0,0,0,0,0,0,0,0,0,1,0,0,0,0
"A young lawyer defends a black man accused of murdering two men who raped his 10-year-old daughter, sparking a rebirth of the KKK.",0,0,0,0,1,0,1,0,0,0,0,0,0,0,0,0,1,0,0
Three inner-city losers plan a robbery of a valuable coin in a seedy second-hand junk shop.,0,0,0,0,0,0,1,0,0,0,0,0,0,0,0,0,0,0,0
Three stories of love and coincidence around the theme of dates in Paris.,0,0,0,1,0,0,0,0,0,0,0,0,0,0,1,0,0,0,0
"Jake Barnes and his two kids, Sean and Jessie, have moved to Alaska after his wife died. He is a former airline pilot now delivering toilet paper across the mountains. During an emergency delivery in a storm his plane goes down somewhere in the mountains. Annoyed that the authorities aren't doing enough, Jessie and Sean set out on an adventure to find their father with the help of a polar bear which they have saved from a ferocious poacher. Conflict ensues.",0,1,0,0,0,0,0,0,0,0,0,0,0,0,0,0,0,0,0
"During a routine prison work detail, convict Piper is chained to Dodge, a cyberhacker, when gunfire breaks out. Apparently, the attack is related to stolen money that the Mafia is after, and some computer files that somebody wants desperately to bury. The pair, who don't exactly enjoy each other's company, escape and must work together if they are to reach Atlanta alive. Luckily, they meet a woman who may be willing to help them.",1,0,0,1,0,0,0,0,0,0,0,0,0,0,0,0,1,0,0
Shaquille O'Neal as a rapping genie protects a little boy.,0,0,0,1,0,0,0,1,1,0,0,0,0,0,0,1,0,0,0
"Motivational Speaker Jack Corcoran is determined to get his career off the ground, but the biggest gigs he can get are the ones nobody wants. Then one day, he receives a telegram that his circus clown father has passed away, and has left a ""huge"" inheritance. When he gets there, he finds that his inheritance has come in the form of an elephant that was his father's pride and joy in circus acts. His main intention is to sell the pachyderm off. Jack must choose between loud and rude zookeeper Mo or attractive animal show owner Terry. As the two treks through the country Jack and the elephant develop a bond, and it changes his approach on life for the better.",0,0,0,1,0,0,0,1,0,0,0,0,0,0,0,0,0,0,0
A controversial talk show host becomes involved in the murder of a beautiful woman in a war for ratings.,1,0,0,0,0,0,0,0,0,0,0,0,0,1,0,0,1,0,0
"A tale of power, passion and obsession set in a politically torn Eastern European country.",0,0,0,0,0,0,1,0,0,0,0,0,0,0,0,0,0,1,0
"A man claiming to be Carol Brady's long-lost first husband, Roy Martin, shows up at the suburban Brady residence one evening. An impostor, the man is actually determined to steal the Bradys' familiar horse statue, a $20-million ancient Asian artifact.",0,0,0,1,0,0,0,0,0,0,0,0,0,0,0,0,0,0,0
"La storia di Stefano (Maurizio Nichetti) sembra molto ""normale"" ma cosa sarebbe successo nella sua vita se... Le molte vite possibili di Stefano si intrecciano in modi imprevedibili",0,0,0,1,0,0,0,0,0,0,0,0,0,0,0,0,0,0,0
"Amid a revolution in a South American mining outpost, a band of fugitives - a roguish adventurer, a local hooker, a priest, an aging diamond miner and his deaf-mute daughter - are forced to flee for their lives into the jungle. Starving, exhausted and stripped of their old identities, they wander desperately lured by one deceptive promise of salvation after another.",0,1,0,0,0,0,1,0,0,0,0,0,0,0,0,0,0,0,0
"'Hedd Wyn' is a 1992 Welsh anti-war biopic. Ellis Humphrey Evans, a farmer's son and poet living at Trawsfynydd in the Meirionydd countryside of upland Wales, competes for the most coveted prize of all in Welsh Poetry - that of the chair of the National Eisteddfod, which in August 1917 was due to be held in Birkenhead (one of the rare occasions when it was held in England). After submitting his entry, under his bardic name ""Hedd Wyn"" (""Blessed Peace"") Evans later departs from Meirionydd by train to join the Royal Welsh Fusiliers in Liverpool, despite his initial misgivings about the war. Ellis  is sent to fight in the trenches of Flanders.  'Hedd Wyn' was the first Welsh-language film to be nominated for an Oscar.",0,0,0,0,0,0,1,0,0,0,0,0,0,0,0,0,0,1,0
"A bombastic, womanizing art dealer and his painter friend go to a seventeenth-century villa on the Riviera for a relaxing summer getaway. But their idyll is disturbed by the presence of the bohemian Haydée, accused of being a “collector” of men.",0,0,0,1,0,0,1,0,0,0,0,0,0,0,1,0,0,0,0
No overview found.,0,0,0,0,0,0,1,0,0,1,0,0,0,0,0,0,0,0,0
"Christoph, cop and self-confident macho, has trouble with his fiance. After a long night he wakes up in the arms of Edgar, a good-looking, gay auto-mechanic. His live gets more and more troublesome after his girl friend throws him out of their apartment and as last resort he moves to Edgars place. Working together with a new, good-looking, very self-confident, female collegue, but living with a good-looking gay guy makes him pretty uncertain about his sexuality and his role as a cop. Written by Konstantin Articus",0,0,0,1,0,0,0,0,0,1,0,0,0,0,0,0,0,0,0
"The journey of Michael Padovic, an American professor who arrives with his wife, Helene, at a Portuguese convent where he expects to find the documents needed to prove his theory: Shakespeare was born in Spain; not in England.",0,0,0,0,0,0,0,0,0,0,0,0,0,0,0,0,1,0,0
"One of puppet-maker Geppetto's creations comes magically to life. This puppet, Pinocchio, has one major desire and that is to become a real boy someday. In order to accomplish this goal he has to learn to act responsibly. This film shows you the adventures on which he learns valuable lessons.",0,0,1,0,0,0,0,1,1,0,0,0,0,0,0,0,0,0,0
"A nice guy has just moved to New York and discovers that he must share his run-down apartment with a couple thousand singing, dancing cockroaches.",0,0,0,1,0,0,0,0,1,0,0,0,1,0,0,0,0,0,0
"After years of helping their hubbies climb the ladder of success, three mid-life Manhattanites have been dumped for a newer, curvier model. But the trio is determined to turn their pain into gain. They come up with a cleverly devious plan to hit their exes where it really hurts - in the wallet!",0,0,0,1,0,0,0,0,0,0,0,0,0,0,0,0,0,0,0
A group of homosexual people try to live with dignity and self-respect while events build to the opening battle in the major gay rights movement.,0,0,0,1,0,0,1,0,0,0,0,0,0,0,1,0,0,0,0
"When a rich man's son is kidnapped, he cooperates with the police at first but then tries a unique tactic against the criminals.",1,0,0,0,0,0,0,0,0,0,0,0,0,0,0,0,1,0,0
"Richard Clark has just left the well-known Wellington Academy to teach at Marion Barry High School. Now, he will try to inspire the D-average students into making good grades and try to woo a fellow teacher.",0,0,0,1,0,0,0,0,0,0,0,0,0,0,0,0,0,0,0
A hefty homeboy borrows his dad's Mercedes and goes to the beach with his friends for wild sun &amp; fun.,0,0,0,1,0,0,0,0,0,0,0,0,0,0,0,0,0,0,0
The story of five teenage girls who form an unlikely bond after beating up a teacher who has sexually harassed them. They build a solid friendship but their wild ways begin to get out of control.,1,0,0,0,0,0,1,0,0,0,0,0,0,0,0,0,1,0,0
Two researchers in a green alternative energy project are put on the run when they are framed for murder and treason.,1,0,0,0,0,0,1,0,0,0,0,0,0,0,0,1,1,0,0
"A grouchy couple are parents to a very sweet girl, Matilda. Unlike her bratty brother and mean parents, Matilda becomes a very sweet and extremely intelligent 6 year old girl, who is very keen to go to school and read books. After a while, her parents send her to school with the worst principal in the world, a very sweet teacher, and good friends. While trying to put up with her parents' and principal's cruelty, she starts to unwittingly unleash telekinetic powers, destroying a television and making a newt fly onto the principal. With enough practice, Matilda starts to learn to control her telekinetic powers and soon using them on her principal so she can drive her away from the school.",0,0,0,1,0,0,0,1,1,0,0,0,0,0,0,0,0,0,0
"Emma Woodhouse is a congenial young lady who delights in meddling in other people’s affairs. She is perpetually trying to unite men and women who are utterly wrong for each other. Despite her interest in romance, Emma is clueless about her own feelings, and her relationship with gentle Mr. Knightly.",0,0,0,1,0,0,1,0,0,0,0,0,0,0,1,0,0,0,0
"After Ashe and his little son are murdered violently for no reason by Judah's men, he returns from the dead to take revenge. One after one, Judah's people face the power of the dark angel. The second film based on James O'Barr's cult comic.",1,0,0,0,0,0,0,0,1,0,0,0,0,0,0,0,1,0,0
"High-schooler Grover Beindorf and his younger sister Stacy decide that their parents, Janet and Ned, are acting childishly when they decide to divorce after 18 years of marriage, so they lock them up in the basement until they'll sort out their problems. Their school friends also decide to do the same with their parents to solve their respective problems",0,0,0,1,0,0,0,1,0,0,0,0,0,0,0,0,0,0,0
Professor Genessier is guilt-stricken after his daughter's face is disfigured in a car accident. He intends to rebuild his daughter's face via grafting skin tissue; he only needs a supply of donors to experiment on.,0,0,0,0,0,0,1,0,0,0,0,1,0,0,0,0,1,0,0
"Private eye Rafe Guttman is hired by repressed, born-again Katherine to find her missing bad-boy brother. The trail leads him to a whorehouse run by a thousand-year-old vampire and secretly backed by Katherine's boss, televangelist Jimmy Current.",0,0,0,1,0,0,0,0,0,0,0,1,0,0,0,0,0,0,0
"This film tells two interwoven stories of two single-parent families in a poor, racially-mixed neighborhood in Brooklyn. The first story is about a young black man (with aspirations of getting away from his friends who are involved in drugs) who falls in love with a latino girl (who is heading off to college on a full scholarship). The second is about their parents, (she works in the neighborhood liquor store; he works for the phone company). The story takes place against the backdrop of a winning lottery ticket worth $27 million being sold to someone in the neighborhood from the liquor store.",0,0,0,0,0,0,1,0,0,0,0,0,0,0,0,0,0,0,0
"The same situation is played out in different cities (New York, Berlin and Japan). A lover has to choose whether to commit to a partner who is returning home. In each case there are other people involved, an ex-partner and someone else in a ""permanent"" relationship, what do they choose to do?",0,0,0,0,0,0,1,0,0,0,0,0,0,0,1,0,0,0,0
"Benny, a hapless grifter, is thrown off a train after cheating at cards, and into the life of Tanya, a lovely bartender. Tanya has been supporting her husband, a former ballplayer, since his accident, waiting for an insurance settlement that will solve all their financial woes. But when it comes, he refuses to share it with her, claiming with newfound piety that money is the root of all evil. She then enlists the help of Benny to concoct a scheme to get her fair share of the settlement, and he finds one: a local Catholic mission needs money for repairs and Benny decides to create a miracle that will encourage husband Henry to fork over the money - which Benny and Tanya will intercept and share.",0,0,0,0,0,0,1,0,0,0,0,0,0,0,0,0,0,0,0
"Percy, upon being released from prison, goes to the small town of Gillead, to find a place where she can start over again. She is taken in by Hannah, to help out at her place, the Spitfire Grill. Percy brings change to the small town, stirring resentment and fear in some, and growth in others.",0,0,0,1,0,0,1,0,0,0,0,0,0,0,0,0,0,0,0
