overview,Action,Adventure,Animation,Comedy,Crime,Documentary,Drama,Family,Fantasy,Foreign,History,Horror,Music,Mystery,Romance,Science Fiction,Thriller,War,Western
"Led by Woody, Andy's toys live happily in his room until Andy's birthday brings Buzz Lightyear onto the scene. Afraid of losing his place in Andy's heart, Woody plots against Buzz. But when circumstances separate Buzz and Woody from their owner, the duo eventually learns to put aside their differences.",0,0,1,1,0,0,0,1,0,0,0,0,0,0,0,0,0,0,0
"When siblings Judy and Peter discover an enchanted board game that opens the door to a magical world, they unwittingly invite Alan -- an adult who's been trapped inside the game for 26 years -- into their living room. Alan's only hope for freedom is to finish the game, which proves risky as all three find themselves running from giant rhinoceroses, evil monkeys and other terrifying creatures.",0,1,0,0,0,0,0,1,1,0,0,0,0,0,0,0,0,0,0
"A family wedding reignites the ancient feud between next-door neighbors and fishing buddies John and Max. Meanwhile, a sultry Italian divorcée opens a restaurant at the local bait shop, alarming the locals who worry she'll scare the fish away. But she's less interested in seafood than she is in cooking up a hot time with Max.",0,0,0,1,0,0,0,0,0,0,0,0,0,0,1,0,0,0,0
"Cheated on, mistreated and stepped on, the women are holding their breath, waiting for the elusive ""good man"" to break a string of less-than-stellar lovers. Friends and confidants Vannah, Bernie, Glo and Robin talk it all out, determined to find a better way to breathe.",0,0,0,1,0,0,1,0,0,0,0,0,0,0,1,0,0,0,0
"Just when George Banks has recovered from his daughter's wedding, he receives the news that she's pregnant ... and that George's wife, Nina, is expecting too. He was planning on selling their home, but that's a plan that -- like George -- will have to change with the arrival of both a grandchild and a kid of his own.",0,0,0,1,0,0,0,0,0,0,0,0,0,0,0,0,0,0,0
"Obsessive master thief, Neil McCauley leads a top-notch crew on various insane heists throughout Los Angeles while a mentally unstable detective, Vincent Hanna pursues him without rest. Each man recognizes and respects the ability and the dedication of the other even though they are aware their cat-and-mouse game may end in violence.",1,0,0,0,1,0,1,0,0,0,0,0,0,0,0,0,1,0,0
"An ugly duckling having undergone a remarkable change, still harbors feelings for her crush: a carefree playboy, but not before his business-focused brother has something to say about it.",0,0,0,1,0,0,0,0,0,0,0,0,0,0,1,0,0,0,0
"A mischievous young boy, Tom Sawyer, witnesses a murder by the deadly Injun Joe. Tom becomes friends with Huckleberry Finn, a boy with no future and no family. Tom has to choose between honoring a friendship or honoring an oath because the town alcoholic is accused of the murder. Tom and Huck go through several adventures trying to retrieve evidence.",1,1,0,0,0,0,1,1,0,0,0,0,0,0,0,0,0,0,0
"International action superstar Jean Claude Van Damme teams with Powers Boothe in a Tension-packed, suspense thriller, set against the back-drop of a Stanley Cup game.Van Damme portrays a father whose daughter is suddenly taken during a championship hockey game. With the captors demanding a billion dollars by game's end, Van Damme frantically sets a plan in motion to rescue his daughter and abort an impending explosion before the final buzzer...",1,1,0,0,0,0,0,0,0,0,0,0,0,0,0,0,1,0,0
James Bond must unmask the mysterious head of the Janus Syndicate and prevent the leader from utilizing the GoldenEye weapons system to inflict devastating revenge on Britain.,1,1,0,0,0,0,0,0,0,0,0,0,0,0,0,0,1,0,0
"Widowed U.S. president Andrew Shepherd, one of the world's most powerful men, can have anything he wants -- and what he covets most is Sydney Ellen Wade, a Washington lobbyist. But Shepherd's attempts at courting her spark wild rumors and decimate his approval ratings.",0,0,0,1,0,0,1,0,0,0,0,0,0,0,1,0,0,0,0
"When a lawyer shows up at the vampire's doorstep, he falls prey to his charms and joins him in his search for fresh blood. Enter Dr. van Helsing, who may be the only one able to vanquish the count.",0,0,0,1,0,0,0,0,0,0,0,1,0,0,0,0,0,0,0
"An outcast half-wolf risks his life to prevent a deadly epidemic from ravaging Nome, Alaska.",0,1,1,0,0,0,0,1,0,0,0,0,0,0,0,0,0,0,0
"An all-star cast powers this epic look at American President Richard M. Nixon, a man carrying the fate of the world on his shoulders while battling the self-destructive demands within. Spanning his troubled boyhood in California to the shocking Watergate scandal that would end his presidency.",0,0,0,0,0,0,1,0,0,0,1,0,0,0,0,0,0,0,0
"Morgan Adams and her slave, William Shaw, are on a quest to recover the three portions of a treasure map. Unfortunately, the final portion is held by her murderous uncle, Dawg. Her crew is skeptical of her leadership abilities, so she must complete her quest before they mutiny against her. This is made yet more difficult by the efforts of the British crown to end her pirate raids.",1,1,0,0,0,0,0,0,0,0,0,0,0,0,0,0,0,0,0
The life of the gambling paradise – Las Vegas – and its dark mafia underbelly.,0,0,0,0,1,0,1,0,0,0,0,0,0,0,0,0,0,0,0
"Rich Mr. Dashwood dies, leaving his second wife and her daughters poor by the rules of inheritance. Two daughters are the titular opposites.",0,0,0,0,0,0,1,0,0,0,0,0,0,0,1,0,0,0,0
It's Ted the Bellhop's first night on the job...and the hotel's very unusual guests are about to place him in some outrageous predicaments. It seems that this evening's room service is serving up one unbelievable happening after another.,0,0,0,1,1,0,0,0,0,0,0,0,0,0,0,0,0,0,0
"Summoned from an ashram in Tibet, Ace finds himself on a perilous journey into the jungles of Africa to find Shikaka, the missing sacred animal of the friendly Wachati tribe. He must accomplish this before the wedding of the Wachati's Princess to the prince of the warrior Wachootoos. If Ace fails, the result will be a vicious tribal war.",0,1,0,1,1,0,0,0,0,0,0,0,0,0,0,0,0,0,0
"A vengeful New York transit cop decides to steal a trainload of subway fares; his foster brother, a fellow cop, tries to protect him.",1,0,0,1,1,0,0,0,0,0,0,0,0,0,0,0,0,0,0
"Chili Palmer is a Miami mobster who gets sent by his boss, the psychopathic ""Bones"" Barboni, to collect a bad debt from Harry Zimm, a Hollywood producer who specializes in cheesy horror films. When Chili meets Harry's leading lady, the romantic sparks fly. After pitching his own life story as a movie idea, Chili learns that being a mobster and being a Hollywood producer really aren't all that different.",0,0,0,1,1,0,0,0,0,0,0,0,0,0,0,0,1,0,0
An agoraphobic psychologist and a female detective must work together to take down a serial killer who copies serial killers from the past.,0,0,0,0,0,0,1,0,0,0,0,0,0,0,0,0,1,0,0
"Assassin Robert Rath arrives at a funeral to kill a prominent mobster, only to witness a rival hired gun complete the job for him -- with grisly results. Horrified by the murder of innocent bystanders, Rath decides to take one last job and then return to civilian life. But finding his way out of the world of contract killing grows ever more dangerous as Rath falls for his female target and becomes a marked man himself.",1,1,0,0,1,0,0,0,0,0,0,0,0,0,0,0,1,0,0
"Harassed by classmates who won't accept his shocking appearance, a shy young man known as ""Powder"" struggles to fit in. But the cruel taunts stop when Powder displays a mysterious power that allows him to do incredible things. This phenomenon changes the lives of all those around him in ways they never could have imagined.",0,0,0,0,0,0,1,0,1,0,0,0,0,0,0,1,1,0,0
"Ben Sanderson, an alcoholic Hollywood screenwriter who lost everything because of his drinking, arrives in Las Vegas to drink himself to death. There, he meets and forms an uneasy friendship and non-interference pact with prostitute Sera.",0,0,0,0,0,0,1,0,0,0,0,0,0,0,1,0,0,0,0
The evil Iago pretends to be friend of Othello in order to manipulate him to serve his own end in the film version of this Shakespeare classic.,0,0,0,0,0,0,1,0,0,0,0,0,0,0,0,0,0,0,0
"Waxing nostalgic about the bittersweet passage from childhood to puberty in this tender coming-of-age tale, four childhood girlfriends -- Teeny, Chrissy, Samantha and Roberta -- recall the magical summer of 1970. During their walk down memory lane, they reconcile experiences with boys, secrets, bullies and more.",0,0,0,1,0,0,1,1,0,0,0,0,0,0,0,0,0,0,0
"This film adaptation of Jane Austen's last novel follows Anne Elliot, the daughter of a financially troubled aristocratic family, who is persuaded to break her engagement to Frederick Wentworth, a young sea captain of meager means. Years later, money troubles force Anne's father to rent out the family estate to Admiral Croft, and Anne is again thrown into company with Frederick -- who is now rich, successful and perhaps still in love with Anne.",0,0,0,0,0,0,1,0,0,0,0,0,0,0,1,0,0,0,0
"A scientist in a surrealist society kidnaps children to steal their dreams, hoping that they slow his aging process.",0,1,0,0,0,0,0,0,1,0,0,0,0,0,0,1,0,0,0
A provincial boy related to a Shanghai crime family is recruited by his uncle into cosmopolitan Shanghai in the 1930s to be a servant to a ganglord's mistress.,0,0,0,0,1,0,1,0,0,0,0,0,0,0,0,0,0,0,0
"Former Marine Louanne Johnson lands a gig teaching in a pilot program for bright but underachieving teens at a notorious inner-city high school. After having a terrible first day, she decides she must throw decorum to the wind. When Johnson returns to the classroom, she does so armed with a no-nonsense attitude informed by her military training and a fearless determination to better the lives of her students -- no matter what the cost.",0,0,0,0,1,0,1,0,0,0,0,0,0,0,0,0,0,0,0
"In the year 2035, convict James Cole reluctantly volunteers to be sent back in time to discover the origin of a deadly virus that wiped out nearly all of the earth's population and forced the survivors into underground communities. But when Cole is mistakenly sent to 1990 instead of 1996, he's arrested and locked up in a mental hospital. There he meets psychiatrist Dr. Kathryn Railly, and patient Jeffrey Goines, the son of a famous virus expert, who may hold the key to the mysterious rogue group, the Army of the 12 Monkeys, thought to be responsible for unleashing the killer disease.",0,0,0,0,0,0,0,0,0,0,0,0,0,1,0,1,1,0,0
"Babe is a little pig who doesn't quite know his place in the world. With a bunch of odd friends, like Ferdinand the duck who thinks he is a rooster and Fly the dog he calls mom, Babe realizes that he has the makings to become the greatest sheep pig of all time, and Farmer Hogget knows it. With the help of the sheep dogs Babe learns that a pig can be anything that he wants to be.",0,0,0,1,0,0,1,1,1,0,0,0,0,0,0,0,0,0,0
"The story of the relationship between painter Dora Carrington and author Lytton Strachey in a World War One England of cottages and countryside. Although platonic due to Strachey's homosexuality, the relationship was nevertheless a deep and complicated one. When Carrington did develop a more physical relationship with soldier Ralph Partridge, Strachey was able to welcome him as a friend, although Partridge remained somewhat uneasy, not so much with Strachey's lifestyle and sexual orientation as with the fact that he was a conscientious objector.",0,0,0,0,0,0,1,0,0,0,1,0,0,0,1,0,0,0,0
A justice drama based on a true story about a man on death row who in his last days forms a strong relationship with a nun who teaches him forgiveness and gives him spirituality as she accompanies him to his execution. Susan Sarandon won an Oscar for best female actress for her convincing portrayal of Sister Helen Prejean.,0,0,0,0,0,0,1,0,0,0,0,0,0,0,0,0,0,0,0
"A young Russian boy, Thomas Minton, travels to New York as a passenger on a Russian freighter. Close to Ellis Island he gets off and thus starts his journey to America the same way as all immigrants in former times. Thomas is searching for the family of one of his ancestors, who had emigrated decades ago, but once sent a letter home together with a sample of his new profession: 3D-Photography. The boy follows his relative's traces by counter-checking the old 3D-Photographs of New York (using an antique viewer) with the same places and how they look today. This way, the audience gets to see the Big Apple in former times as well as today.",0,1,0,0,0,0,1,1,0,0,1,0,0,0,0,0,0,0,0
"Identical 9-year-olds from very different backgrounds: orphaned Amanda and wealthy Alyssa meet at summer camp and decide to switch places -- and play matchmaker between Alyssa's dad, Roger, and the kind social worker who cares for Amanda.",0,0,0,1,0,0,0,1,0,0,0,0,0,0,1,0,0,0,0
"Shallow, rich and socially successful Cher is at the top of her Beverly Hills high school's pecking scale. Seeing herself as a matchmaker, Cher first coaxes two teachers into dating each other. Emboldened by her success, she decides to give hopelessly klutzy new student Tai a makeover. When Tai becomes more popular than she is, Cher realizes that her disapproving ex-stepbrother was right about how misguided she was -- and falls for him.",0,0,0,1,0,0,1,0,0,0,0,0,0,0,1,0,0,0,0
A South-African preacher goes to search for his wayward son who has committed a crime in the big city.,0,0,0,0,0,0,1,0,0,0,0,0,0,0,0,0,0,0,0
Shakespeare's Play transplanted into a 1930s setting.,0,0,0,0,0,0,1,0,0,0,0,0,0,0,0,0,0,1,0
"Depicts a heist of old bills, retired from circulation and destined by the government to be ""money to burn"". However, more broadly, it addresses the issues of Black Americans' involvement in the Vietnam War and their subsequent disillusionment with progress in social issues and civil rights back home in the United States, during the 1960s.",1,0,0,0,1,0,1,0,0,0,1,0,0,0,0,0,0,0,0
"An aspiring young physician, Robert Merivel found himself in the service of King Charles II and saves the life of someone close to the King. Merivel joins the King's court and lives the high life provided to someone of his position. Merivel is ordered to marry his King's mistress in order to divert the queens suspicions. He is given one order by the king and that is not to fall in love. The situation worsens when Merivel finds himself in love with his new wife. Eventually, the King finds out and relieves Merivel of his position and wealth. His fall from grace leaves Merivel where he first started. And through his travels and reunions with an old friend, he rediscovers his love for true medicine and what it really means to be a physician.",0,0,0,0,0,0,1,0,0,0,0,0,0,0,1,0,0,0,0
"For nine generations an evil sorcerer has been victorious in hand-to-hand battle against his mortal enemies. If he wins a tenth Mortal Kombat tournament, desolation and evil will reign over the multiverse forever. To save Earth, three warriors must overcome seemingly insurmountable odds, their own inner demons, and superhuman foes in this action/adventure movie based on one of the most popular video games of all time.",1,0,0,0,0,0,0,0,1,0,0,0,0,0,0,0,0,0,0
"Susan wants to work in television and will therefore do anything it takes, even if it means killing her husband. A very dark comedy from independent director Gus Van Sant with a brilliant Nicole Kidman in the leading role.",0,0,0,1,0,0,1,0,1,0,0,0,0,0,0,0,1,0,0
"Soon-to-be-wed graduate student Finn Dodd develops cold feet when she suspects her fiancé is cheating on her. In order to clear her head, Finn visits her grandmother, Hy, and great aunt, Glady Joe Cleary, in Grasse, Calif. There, Finn learns that Hy and Glady Joe are members of a group of passionate quilters, and over the course of her visit she is regaled with tales of love and life by women who have collected rich experiences and much wisdom.",0,0,0,0,0,0,1,0,0,0,0,0,0,0,1,0,0,0,0
"Two homicide detectives are on a desperate hunt for a serial killer whose crimes are based on the ""seven deadly sins"" in this dark and haunting film that takes viewers from the tortured remains of one victim to the next. The seasoned Det. Sommerset researches each sin in an effort to get inside the killer's mind, while his novice partner, Mills, scoffs at his efforts to unravel the case.",0,0,0,0,1,0,0,0,0,0,0,0,0,1,0,0,1,0,0
"History comes gloriously to life in Disney's epic animated tale about love and adventure in the New World. Pocahontas is a Native American woman whose father has arranged for her to marry her village's best warrior. But a vision tells her change is coming, and soon she comes face to face with it in the form of Capt. John Smith.",0,1,1,0,0,0,1,1,0,0,0,0,0,0,0,0,0,0,0
"A prudish woman, working on tenure as a literacy professor at a large urban university, finds herself strangely attracted to a free-spirited, liberal woman whom works at a local carnival which comes to town.",0,0,0,0,0,0,1,0,0,0,0,0,0,0,1,0,0,0,0
"Held in an L.A. interrogation room, Verbal Kint attempts to convince the feds that a mythic crime lord, Keyser Soze, not only exists, but was also responsible for drawing him and his four partners into a multi-million dollar heist that ended with an explosion in San Pedro harbor – leaving few survivors. Verbal lures his interrogators with an incredible story of the crime lord's almost supernatural prowess.",0,0,0,0,1,0,1,0,0,0,0,0,0,0,0,0,1,0,0
"Detective - turned - bodyguard Cynthia McKay (Cynthia Rothrock) is hired by a psychotic icy seductress, Nina Lindell (Lydie Denier), the same woman who killed Mckay's lover months earlier.  With vendetta in her heart McKay accompanies the flamboyantly playful womanizer through the glamourous world of the super-rich as his protector.  In a unique role reversal, it is the woman protecting the man from another woman, erupting into a deadly triangle of passion, suspense and action.",1,0,0,0,0,0,1,0,0,0,0,0,0,0,0,0,1,0,0
"When Lenny and his wife, Amanda, adopt a baby, Lenny realizes that his son is a genius and becomes obsessed with finding the boy's biological mother in hopes that she will be brilliant too. But when he learns that Max's mother is Linda Ash, a kindhearted prostitute and porn star, Lenny is determined to reform her immoral lifestyle. A Greek chorus chimes in to relate the plot to Greek mythology in this quirky comedy.",0,0,0,1,0,0,0,0,0,0,0,0,0,0,1,0,0,0,0
"Fiore, an Italian conman, arrives in post Communist Albania with Gino, his young apprentice, to set up a shoe factory that will never open. The con requires a native Albanian, so they designate Spiro, an impoverished and confused former political prisoner as chairman of the board. When Fiore returns to Italy to get government funds for the project, Spiro unexpectedly disappears and Gino sets out on a journey to find him. The search leads him to discover Spiro's tragic personal history and witness Albanian poverty firsthand.",0,0,0,0,0,0,1,0,0,1,0,0,0,0,0,0,0,0,0
"In a depressed Texas town, British foreign exchange teacher Anna attempts to inject some life into her hopeless kids by introducing them to soccer. They're terrible at first, but Anna and her football-hero assistant whip them into shape. As they work overtime, the pair help kids build their self-esteem and also get involved in solving family squabbles.",1,1,0,1,0,0,0,1,0,0,0,0,0,0,0,0,0,0,0
"Sadie looks up to her older sister Georgia, a successful folk singer who's happily married with children, but can't break out of the bar-band circuit and hit the big time she desperately covets. It's in part due to her attraction to drugs and booze, and also to her own unwise choice in men. Finally, though, Sadie's Achilles heel is a rough, unlovely voice very different than her sister's crowd-pleasing singing.",0,0,0,0,0,0,1,0,0,0,0,0,0,0,0,0,0,0,0
"After losing her job, making out with her soon to be ex-boss, and finding out that her daughter plans to spend Thanksgiving with her boyfriend, Claudia Larson has to face spending the holiday with her family. She wonders if she can survive their crazy antics.",0,0,0,1,0,0,1,0,0,0,0,0,0,0,1,0,0,0,0
Simple Italian postman learns to love poetry while delivering mail to a famous poet; he uses this to woo local beauty Beatrice.,0,0,0,1,0,0,1,0,0,0,0,0,0,0,1,0,0,0,0
"The year is 1952, in Quebec City. Rachel (16), unmarried and pregnant, works in the church. Filled with shame, she unburdens her guilt to a young priest, under the confidentiality of the confessional. In the present year of 1989, Pierre Lamontagne has returned to Quebec to attend his father's funeral. He meets up with his adopted brother, Marc, who has begun questioning his identity and has embarked on a quest for his roots that would lead them to the Quebec of the 1950s. Past and present converge in a complex web of intrigue where the answer to the mystery lies.",0,0,0,0,0,0,1,0,0,0,0,0,0,1,0,0,1,0,0
A nine-year-old boy gets a plastic Indian and a cupboard for his birthday and finds himself involved in adventure when the Indian comes to life and befriends him.,0,1,0,0,0,0,0,1,1,0,0,0,0,0,0,0,0,0,0
"It's fire and brimstone time as grieving mother Karen McCann takes justice into her own hands when a kangaroo court in Los Angeles fails to convict Robert Doob, the monster who raped and murdered her 17-year-old daughter.",0,0,0,0,0,0,1,0,0,0,0,0,0,0,0,0,1,0,0
"In 1965, passionate musician Glenn Holland takes a day job as a high school music teacher, convinced it's just a small obstacle on the road to his true calling: writing a historic opus. As the decades roll by with the composition unwritten but generations of students inspired through his teaching, Holland must redefine his life's purpose.",0,0,0,0,0,0,1,1,0,0,0,0,1,0,0,0,0,0,0
"When Ashtray (Shawn Wayans) moves to South Central L.A. to live with his father (who appears to be the same age he is) and grandmother (who likes to talk tough and smoke reefer), he falls in with his gang-banging cousin Loc Dog (Marlon Wayans), who along with the requisite pistols and Uzi carries a thermo-nuclear warhead for self-defense. Will Ashtray be able to keep living the straight life?",0,0,0,1,0,0,0,0,0,0,0,0,0,0,0,0,0,0,0
"Frank O'Brien, a petty thief, and his 7-year-long girlfriend Roz want to put an end to their unsteady lifestyle and just do that last job, which involves stealing a valuable painting. Frank takes Roz to an island on the coast of New England, where he wants to sell the painting and also hopes that their sagging relationship will get a positive push back up. Not everything goes as planned.",0,0,0,1,0,0,0,0,0,0,0,0,0,0,1,0,0,0,0
"Bud and Doyle are two losers who are doing nothing with their lives. Both of their girlfriends are actively involved in saving the environment, but the two friends couldn't care less about saving the Earth. One day, when a group of scientists begin a mission to live inside a ""Bio-Dome"" for a year without outside contact, Bud and Doyle mistakenly become part of the project themselves.",0,0,0,1,0,0,0,0,0,0,0,0,0,0,0,0,0,0,0
"Jobe is resuscitated by Jonathan Walker. He wants Jobe to create a special computer chip that would connect all the computers in the world into one network, which Walker would control and use. But what Walker doesn't realize is a group of teenage hackers are on to him and out to stop his plan.",1,0,0,0,0,0,0,0,0,0,0,0,0,0,0,1,0,0,0
"It's a hot summer day in 1933 in South Philly, where 12-year old Gennaro lives with his widowed mom and his ailing grandpa, who sits outside holding tight to his last quarter, which he's promised to Gennaro and which Gennaro would like to have to buy a ticket to the plush new movie theater. But grandpa's not ready to pass on the quarter or pass on to his final reward: he has some unfinished business with a woman from his past, and he enlists Gennaro to act as his emissary.",0,0,0,0,0,0,1,1,0,0,0,0,0,0,0,0,0,0,0
"After learning of her husband's infidelities, a housewife invites an itinerant lesbian to move in with them. None of their lives will ever be the same again.",0,0,0,1,0,0,0,0,0,0,0,0,0,0,1,0,0,0,0
"Craig and Smokey are two guys in Los Angeles hanging out on their porch on a Friday afternoon, smoking and drinking, looking for something to do.",0,0,0,1,0,0,0,0,0,0,0,0,0,0,0,0,0,0,0
"Seth Gecko and his younger brother Richard are on the run after a bloody bank robbery in Texas. They escape across the border into Mexico and will be home-free the next morning, when they pay off the local kingpin. They just have to survive 'from dusk till dawn' at the rendezvous point, which turns out to be a Hell of a strip joint.",1,0,0,0,1,0,0,0,0,0,0,1,0,0,0,0,1,0,0
"Max Kirkpatrick is a cop who protects Kate McQuean, a civil law attorney, from a renegade KGB team out to terminate her",1,0,0,0,0,0,0,0,0,0,0,0,0,0,1,0,1,0,0
"After college graduation, Grover's girlfriend Jane tells him she's moving to Prague to study writing. Grover declines to accompany her, deciding instead to move in with several friends, all of whom can't quite work up the inertia to escape their university's pull. Nobody wants to make any big decisions that would radically alter his life, yet none of them wants to end up like Chet, the professional student who tends bar and is in his tenth year of university studies.",0,0,0,1,0,0,1,0,0,0,0,0,0,0,1,0,0,0,0
"In France during World War II, a poor and illiterate man, Henri Fortin (Jean-Paul Belmondo), is introduced to Victor Hugo's classic novel Les Misérables and begins to see parallels between the book and his own life.",0,0,0,0,0,0,1,0,0,0,1,0,0,0,0,0,0,0,0
"The seeds of love are planted when Lisa, a high-powered investment banker, receives flowers from a secret admirer. But when his fairy-tale fantasies clash with her workaholic ways, they soon find out that sometimes, it's harder than it seems for love to conquer all.",0,0,0,0,0,0,1,0,0,0,0,0,0,0,1,0,0,0,0
