overview,Action,Adventure,Animation,Comedy,Crime,Documentary,Drama,Family,Fantasy,Foreign,History,Horror,Music,Mystery,Romance,Science Fiction,Thriller,War,Western
"Some thirty years after Arlis witnesses his father murdering a family, he runs into Kay, who happens to be the family's baby who was spared. Kay and Arlis suspect nothing about each other, but when his father returns, old wounds are reopened.",0,0,0,0,0,0,1,0,0,0,0,0,0,1,1,0,0,0,0
Scandal and mystery reign following the arrival of Edwina in a small Irish town populated entirely by widows. Edwina quickly falls out with the locals while also falling in with the son of the community's leader,0,0,0,1,0,0,0,0,0,1,0,0,0,1,1,0,1,0,0
"New York concierge Doug Ireland wants to go into business for himself and refurbish a hotel on Roosevelt Island, N.Y., but he needs an investor. With a few weeks left before his option on the site runs out, Doug agrees to help wealthy Christian Hanover conceal his affair with salesgirl Andy Hart from his wife. Despite his own attraction to Andy, Doug tries to stay focused on getting Christian to invest $3 million in his project.",0,0,0,1,0,0,0,0,0,0,0,0,0,0,1,0,0,0,0
"Mitch McDeere is a young man with a promising future in Law. About to sit his Bar exam, he is approached by 'The Firm' and made an offer he doesn't refuse. Seduced by the money and gifts showered on him, he is totally oblivious to the more sinister side of his company. Then, two Associates are murdered. The FBI contact him, asking him for information and suddenly his life is ruined. He has a choice - work with the FBI, or stay with the Firm. Either way he will lose his life as he knows it. Mitch figures the only way out is to follow his own plan...",0,0,0,0,0,0,1,0,0,0,0,0,0,1,0,0,1,0,0
"When maladjusted orphan Jesse vandalizes a theme park, he is placed with foster parents and must work at the park to make amends. There he meets Willy, a young Orca whale who has been separated from his family. Sensing kinship, they form a bond and, with the help of kindly whale trainer Rae Lindley, develop a routine of tricks. However, greedy park owner Dial soon catches wind of the duo and makes plans to profit from them.",0,1,0,0,0,0,0,1,0,0,0,0,0,0,0,0,0,0,0
"Michael is a 12-year-old drug pusher who lives in a crowded house with his cousins and aunt. His father has become a street bum,but still meets with Fresh on occasion to play chess. Fresh is rather quiet in a crazy world. Fresh's sister is a junkie who sleeps with the dealers that Fresh sells for. As the story progresses Fresh realizes that he doesn't want to sell drugs anymore - he wants revenge.",0,0,0,0,1,0,1,0,0,0,0,0,0,0,0,0,1,0,0
"Wrongfully accused of murdering his wife, Richard Kimble escapes from the law in an attempt to find her killer and clear his name. Pursuing him is a team of U.S. marshals led by Deputy Samuel Gerard, a determined detective who will not rest until Richard is captured. As Richard leads the team through a series of intricate chases, he discovers the secrets behind his wife's death and struggles to expose the killer before it is too late.",1,1,0,0,1,0,0,0,0,0,0,0,0,1,0,0,1,0,0
"The Apache Indians have reluctantly agreed to settle on a US Government approved reservation. Not all the Apaches are able to adapt to the life of corn farmers. One in particular, Geronimo, is restless. Pushed over the edge by broken promises and necessary actions by the government, Geronimo and thirty or so other warriors form an attack team which humiliates the government by evading capture, whi",1,0,0,0,0,0,1,0,0,0,1,0,0,0,0,0,0,0,1
"Doc McCoy is put in prison because his partners chickened out and flew off without him after exchanging a prisoner with a lot of money. Doc knows Jack Benyon, a rich ""business""-man, is up to something big, so he tells his wife (Carol McCoy) to tell him that he's for sale if Benyon can get him out of prison. Benyon pulls some strings and Doc McCoy is released again. Unfortunately he has to cooperate with the same person that got him to prison.",1,0,0,0,0,0,1,0,0,0,0,0,0,0,0,0,1,0,0
"Ray, an ex-con and widower, is planning a coin heist with two accomplices to help him to buy his own bakery. However, he doesn't expect his son Timmy, who was living with Ray's sister, to show up at the house right in the middle of planning. Timmy is ignored and Ray and his buddies pull off the heist. Timmy gets his father's attention by stealing the coins and hiding them. To get them back, his father must take him to a number of different places and treat him like he enjoys his presence. They grow fond of each other but Timmy won't stay with his dad unless he gives up the coins.",0,0,0,1,1,0,0,1,0,0,0,0,0,0,0,0,0,0,0
"Max is a trendy, pretty, young lesbian, who is having trouble finding love. A friend sets her up with Ely, whom Max likes, but Ely is frumpy, homely, and older. Nor do they have much in common. Can Max learn to look past the packaging?",0,0,0,0,0,0,1,0,0,0,0,0,0,0,1,0,0,0,0
"Morgan Leafy is a secretary to the British High Commissioner to an Africa nation. Leafy is a man that makes himself useful to his boss, the snobbish Arthur Fanshawe, who has no clue about what's going on around him, but who wants to use his secretary to carry on his dirty work, which involves getting one of the most powerful men in the country to do business with his country.The young secretary has an eye for beautiful women around him, especially Hazel, a native beauty, with whom he is having an affair. Things get complicated because Sam Adekunle, a man running for president of the country, wants a favor from Leafy in return after he has accepted the invitation to visit London. The proposition involves swaying a prominent doctor's opposition to a plan that will make Adenkule filthy rich.",0,0,0,1,0,0,1,0,0,0,0,0,0,0,0,0,0,0,0
"Before a criminal lawyer knows what has happened, she is forced to defend a wife killer she knows is guilty.",0,0,0,0,0,0,1,0,0,0,0,0,0,0,0,0,1,0,0
"When a woman's father goes missing, she enlist a local to aid in her search.  The pair soon discover that her father has died at the hands of a wealthy sportsman who hunts homeless men as a form of recreation.",1,1,0,0,1,0,0,0,0,0,0,0,0,0,0,0,1,0,0
"Le Ly lives in a small Vietnamese village whose serenity is shattered when war breaks out. Caught between the Viet Cong and the South Vietnamese army, the village is all but destroyed. After being both brutalized and raped, Le Ly resolves to flee. She leaves for the city, surviving desperate situations, but surviving nonetheless. Eventually she meets a U.S. Marine named Steve Butler who treats her kindly and tells her he would like to be married -- maybe to her.",1,0,0,0,0,0,1,0,0,0,1,0,0,0,0,0,0,1,0
"Topper Harley is found to be working as an odd-job-man in a monastery. The CIA want him to lead a rescue mission into Iraq, to rescue the last rescue team, who went in to rescue the last rescue team who... who went in to rescue hostages left behind after Desert Storm.",1,0,0,1,0,0,0,0,0,0,0,0,0,0,0,0,0,1,0
"A group of old friends at a Hens Night discuss their issues, uncertainties, fears and fantasies.",0,0,0,1,0,0,0,0,0,0,0,0,0,0,0,0,0,0,0
"When an English cartographer arrives in Wales to tell the residents of the Welsh village of Ffynnon Garw  that their ""mountain"" is only a hill, the offended community sets out to remedy the situation.  The film is based on a story heard by Christopher Monger from his grandfather about the real village of Taff's Well,  in the old county of Glamorgan, and its neighbouring Garth Hill. However, due to 20th century urbanisation of the area, it was filmed in the more rural Llanrhaeadr-ym-Mochnant and Llansilin areas in Powys.",0,0,0,1,0,0,1,0,0,0,0,0,0,0,1,0,0,0,0
"A rancher, his clairvoyant wife and their family face turbulent years in South America.",0,0,0,0,0,0,1,0,0,0,0,0,0,0,1,0,0,0,0
"Hip Hop duo Kid &amp; Play return in the second follow-up to their 1990 screen debut House Party. Kid (Christopher ""Kid"" Reid) is taking the plunge and marrying his girlfriend Veda (Angela Means), while his friend Play (Christopher Martin) is dipping his toes into the music business, managing a roughneck female rap act called Sex as a Weapon. Play books the ladies for a concert with heavy-hitting pr",0,0,0,1,0,0,0,0,0,0,0,0,0,0,0,0,0,0,0
A naive business graduate is installed as president of a manufacturing company as part of a stock scam.,0,0,0,1,0,0,1,0,0,0,0,0,0,0,0,0,0,0,0
"Matt Hobbs is a talented but unsuccessful actor. When estranged (and strange) ex-wife Beth dumps their daughter Jeannie on Matt, father and daughter have a lot of adjusting to do. His budding relationship with attractive production assistant Cathy Breslow is made complicated, while the precocious child is overly accustomed to getting her own way. Matt eventually faces the choice of family vs career in a particularly difficult way.",0,0,0,1,0,0,1,0,0,0,0,0,0,0,0,0,0,0,0
"Bones Conway and Jack Kaufman didn't really know what they were in for when they enlisted in the U.S. Army; they just wanted to get a job and make some money. But these new recruits are so hapless, they run the risk of getting kicked out before their military careers even begin. Soon, though, they're sent to the Middle East to fight for their country -- which they manage to do in their own wacky ways.",0,0,0,1,0,0,0,0,0,0,0,0,0,0,0,0,0,0,0
"Veteran Secret Service agent Frank Horrigan is a man haunted by his failure to save President Kennedy while serving protection detail in Dallas. Thirty years later, a man calling himself ""Booth"" threatens the life of the current President, forcing Horrigan to come back to protection detail to confront the ghosts from his past.",1,0,0,0,1,0,1,0,0,0,0,0,0,1,0,0,1,0,0
"A small time thief from Belfast, Gerry Conlon, is falsely implicated in the IRA bombing of a pub that kills several people while he is in London. He and his four friends are coerced by British police into confessing their guilt. Gerry's father and other relatives in London are also implicated in the crime. He spends fifteen years in prison with his father trying to prove his innocence.",0,0,0,0,0,0,1,0,0,0,0,0,0,0,0,0,0,0,0
The Inkwell is about a 16-year-old boy coming of age on Martha's Vineyard in the summer of 1976.,0,0,0,1,0,0,1,0,0,0,0,0,0,0,1,0,0,0,0
A film about the singer Tina Turner and how she rose to stardom with her abusive husband Ike Turner and how she gained the courage to break free.,0,0,0,0,0,0,1,0,0,0,0,0,1,0,0,0,0,0,0
"Jimmy Alto is an actor wannabe who stumbles into the role of a lifetime. He becomes a vigilante crime-fighter, aided by his sidekick William, who has suffered a head wound and has problems with short-term memory. Jimmy's vigilante alter ego soon becomes a media wonder--but Jimmy remains a total unknown and his long-suffering girl friend Lorraine is getting fed up with the whole situation.",0,0,0,1,0,0,0,0,0,0,0,0,0,0,0,0,0,0,0
"While racing to a boxing match, Frank, Mike, John and Rey get more than they bargained for. A wrong turn lands them directly in the path of Fallon, a vicious, wise-cracking drug lord. After accidentally witnessing Fallon murder a disloyal henchman, the four become his unwilling prey in a savage game of cat &amp; mouse as they are mercilessly stalked through the urban jungle in this taut suspense drama",1,0,0,0,1,0,0,0,0,0,0,0,0,0,0,0,1,0,0
"A wealthy entrepreneur secretly creates a theme park featuring living dinosaurs drawn from prehistoric DNA. Before opening day, he invites a team of experts and his two eager grandchildren to experience the park and help calm anxious investors. However, the park is anything but amusing as the security systems go off-line and the dinosaurs escape.",0,1,0,0,0,0,0,0,0,0,0,0,0,0,0,1,0,0,0
"A journalist duo go on a tour of serial killer murder sites with two companions, unaware that one of them is a serial killer himself.",0,0,0,0,1,0,0,0,0,0,0,0,0,0,0,0,1,0,0
"Zed (Eric Stoltz) is an American vault-cracker who travels to Paris to meet up with his old friend Eric (Jean-Hugues Anglade). Eric and his gang have planned to raid the only bank in the city which is open on Bastille day. After offering his services, Zed soon finds himself trapped in a situation beyond his control when heroin abuse, poor planning and a call-girl named Zoe all conspire to turn the robbery into a very bloody siege.",1,0,0,0,1,0,1,0,0,0,0,0,0,0,0,0,1,0,0
"Based on the Depression-era bildungsroman memoir of writer A. E. Hotchner, the film follows the story of a boy struggling to survive on his own in a hotel in St. Louis after his mother is committed to a sanatorium with tuberculosis. His father, a German immigrant and traveling salesman working for the Hamilton Watch Company, is off on long trips from which the boy cannot be certain he will return.",0,0,0,0,0,0,1,0,0,0,0,0,0,0,0,0,0,0,0
"An update of the Lassie legend stars Thomas Guiry as a troubled city kid whose family retreats to the country, where he befriends the famous collie and changes for the better. Conflict develops when a ruthless sheep rancher causes trouble for everyone.",1,1,0,0,0,0,1,1,0,0,0,0,0,0,0,0,0,0,0
"Danny is obsessed with a fictional movie character action hero Jack Slater. When a magical ticket transports him into Jack's latest adventure, Danny finds himself in a world where movie magic and reality collide. Now it's up to Danny to save the life of his hero and new friend.",1,1,0,1,0,0,0,1,1,0,0,0,0,0,0,0,0,0,0
"Michael Chapman was once a child TV star. But when he grew up, he couldn't get work. So he and his brother, Ed start their own talent agency that specializes in child acts. They can't seem to find the next big thing and they have to deal with another agency who's not above bribery to get the kids to sign with them. One day Michael meets a girl named Angie and she's a real spitfire. Michael thinks she could be what they are looking for. Problem is that she has a big chip on her shoulder.",0,0,0,1,0,0,0,1,0,0,0,0,0,0,0,0,0,0,0
"Lightning Jack Kane is an Australian outlaw in the wild west. During a bungled bank robbery he picks up mute Ben Doyle as a hostage. The two become good friends, with Jack teaching Ben how to rob banks, while they plan Jack's last heist.",1,0,0,1,0,0,0,0,0,0,0,0,0,0,0,0,0,0,1
"In 1960s China, French diplomat Rene Gallimard falls in love with an opera singer, Song Liling - but Song is not at all who Gallimard thinks.",0,0,0,0,0,0,1,0,0,0,0,0,0,0,1,0,0,0,0
"A young black woman discovers that her father was a sperm donor, and if that weren't bad enough, he's white.",0,0,0,1,0,0,0,0,0,0,0,0,0,0,0,0,0,0,0
"A tale about a happily married couple who would like to have children. Tracy teaches infants, Andy's a college professor. Things are never the same after she is taken to hospital and operated upon by Jed, a ""know all"" doctor.",0,0,0,0,1,0,1,0,0,0,0,0,0,0,0,0,0,0,0
"The story of a relationship between a teacher and his troubled pupil. Justin McLeod is a former teacher who lives as a recluse on the edge of town. His face is disfigured from an automobile accident and fire ten years before in which a boy was incinerated and for which he was convicted of involuntary manslaughter. He is also suspected of being a pedophile. He is befriended by Chuck, causing the town's suspicion and hostility to be ignited. McLeod inculcates in his protege a love of justice and freedom from prejudice which sustains him beyond the end of the film.",0,0,0,0,0,0,1,0,0,0,0,0,0,0,0,0,0,0,0
A middle-aged couple suspects foul play when their neighbor's wife suddenly drops dead.,0,0,0,1,0,0,0,0,0,0,0,0,0,1,0,0,0,0,0
"Menace II Society is a coming of age tale detailing the summer after its protagonist Caine (Tyrin Turner) graduates from high school. This is Caine's story, which details real life in today's tough inner city.",1,0,0,0,1,0,1,0,0,0,0,0,0,0,0,0,0,0,0
"Terrorists hijack a 747 inbound to Washington D.C., demanding the the release of their imprisoned leader. Intelligence expert David Grant (Kurt Russell) suspects another reason and he is soon the reluctant member of a special assault team that is assigned to intercept the plane and hijackers.",1,1,0,0,0,0,1,0,0,0,0,0,0,0,0,0,1,0,0
"Based on a true story set in pre-war Japan, a man and one of his servants begin a torrid affair. Their desire becomes a sexual obsession so strong that to intensify their ardor, they forsake all, even life itself.",0,0,0,0,0,0,1,0,0,0,0,0,0,0,1,0,0,0,0
"Jackie and Michael are coworkers at a large law firm, who decide to meet at Jackie's for dinner one night.",0,0,0,1,0,0,1,0,0,0,0,0,0,0,1,0,1,0,0
"In this Shakespearean farce, Hero and her groom-to-be, Claudio, team up with Claudio's commanding officer, Don Pedro, the week before their wedding to hatch a matchmaking scheme. Their targets are sharp-witted duo Benedick and Beatrice -- a tough task indeed, considering their corresponding distaste for love and each other. Meanwhile, meddling Don John plots to ruin the wedding.",0,0,0,1,0,0,1,0,0,0,0,0,0,0,1,0,0,0,0
"The story about the relationship between a manic depressive man, Mr Jones, and the female doctor who takes more than a professional interest in his treatment.",0,0,0,0,0,0,1,0,0,0,0,0,0,0,1,0,0,0,0
Electrician Gus gets the chance to fulfill a childhood dream by buying an old bowling-alley with some of his friends.,0,0,0,1,0,0,0,0,0,0,0,0,0,0,1,0,0,0,0
"Loving but irresponsible dad Daniel Hillard, estranged from his exasperated spouse, is crushed by a court order allowing only weekly visits with his kids. When Daniel learns his ex needs a housekeeper, he gets the job -- disguised as an English nanny. Soon he becomes not only his children's best pal but the kind of parent he should have been from the start.",0,0,0,1,0,0,1,1,0,0,0,0,0,0,0,0,0,0,0
"Johnny flees Manchester for London, to avoid a beating from the family of a girl he has raped. There he finds an old girlfriend, and spends some time homeless, spending much of his time ranting at strangers, and meeting characters in plights very much like his own.",0,0,0,1,0,0,1,0,0,0,0,0,0,0,0,0,0,0,0
"During a commemoration for Japanese soldiers fighting in the US Army during World War II, Mr. Miyagi meets the widow of his commanding officer. He gets to know her granddaughter Julie, an angry teenager who is still feeling the pain of losing both her parents in an accident and is having problems with her grandmother and her fellow pupils. Mr. Miyagi decides to teach her karate to get her through her pain and issues and back on the right path.",0,1,0,0,0,0,0,0,0,0,0,0,0,0,0,0,0,0,0
"Peter and Katherine Witner are Southern California super-yuppies with great jobs but no center to their lives. When they both lose their jobs and begin marital infidelities, their solution is to start their own business together. In order to find meaning to their empty lives, they follow various New Age gurus and other such groups. Eventually, they hit rock bottom and have make some hard decisions",0,0,0,1,0,0,1,0,0,0,0,0,0,0,0,0,0,0,0
"In the year 2022, a ruthless prison warden has created the ultimate solution for his most troublesome and violent inmates: Absolom, a secret jungle island where prisoners are abandoned and left to die. But Marine Captain John Robbins, convicted of murdering a commanding officer, is determined to escape the island in order to reveal the truth behind his murderous actions and clear his name.",1,0,0,0,0,0,1,0,0,0,0,0,0,0,0,1,1,0,0
"Eleven-year-old North has had it with his parents. They are always busy with their careers and don't give North the attention he needs, so he files a lawsuit against them. The judge rules that North should either find new parents or return to his own parents within two months. Thus north starts off on an hilarious journey around the world to find the parents that really care about him.",0,0,0,1,0,0,1,1,1,0,0,0,0,0,0,1,0,0,0
"In 1600, nobleman Orlando inherits his parents' house, thanks to Queen Elizabeth I, who commands the young man to never change. After a disastrous affair with Russian princess Sasha, Orlando looks for solace in the arts before being appointed ambassador to Constantinople in 1700, where war is raging. One morning, Orlando is shocked to wake up as a woman and returns home, struggling as a female to retain her property as the centuries roll by.",0,0,0,0,0,0,1,0,1,0,0,0,0,0,1,0,0,0,0
"A kidnapped boy strikes up a friendship with his captor: an escaped convict on the run from the law, headed by an honorable U.S. Marshal.",0,0,0,0,1,0,1,0,0,0,0,0,0,0,0,0,1,0,0
No one would take his case until one man was willing to take on the system. Two competing lawyers join forces to sue a prestigious law firm for AIDS discrimination. As their unlikely friendship develops their courage overcomes the prejudice and corruption of their powerful adversaries.,0,0,0,0,0,0,1,0,0,0,0,0,0,0,0,0,0,0,0
"After a long voyage from Scotland, pianist Ada McGrath and her young daughter, Flora, are left with all their belongings, including a piano, on a New Zealand beach. Ada, who has been mute since childhood, has been sold into marriage to a local man named Alisdair Stewart. Making little attempt to warm up to Alisdair, Ada soon becomes intrigued by his Maori-friendly acquaintance, George Baines, leading to tense, life-altering conflicts.",0,0,0,0,0,0,1,0,0,0,0,0,0,0,1,0,0,0,0
"In this film, we see the world through the eyes of main character Justice, a young African-American poet. A mail carrier invites a few friends along for a long overnight delivery run.",0,0,0,0,0,0,1,0,0,0,0,0,0,0,1,0,0,0,0
"Several players from different backgrounds try to cope with the pressures of playing football at a major university. Each deals with the pressure differently, some turn to drinking, others to drugs, and some to studying.",0,0,0,0,0,0,1,0,0,0,0,0,0,0,0,0,0,0,0
"The Earth is invaded by alien parasites aka ""slugs"" that ride on people's backs and control their minds. A trio of American government agents attempt to thwart this.",0,0,0,0,0,0,0,0,0,0,0,1,0,0,0,1,1,0,0
"In 1939, WBN, a fourth radio network, is about to take to America's airwaves. As if the confusion of the premiere night wasn't enough, Penny Henderson, the owner's secretary, must deal with an unhappy sponsor, an overbearing boss and a soon-to-be ex-husband who desperately wants her back. As the broadcast begins, a mysterious voice breaks the broadcast and suddenly members of the cast turn up dead. It's up to her husband Roger, to find out whodunit as the police chase him through the halls of WBN.",0,0,0,1,1,0,1,0,0,0,0,0,1,1,1,0,0,0,0
"A cat burglar is forced to take a bickering, dysfunctional family hostage on Christmas Eve.",0,0,0,1,0,0,0,0,0,0,0,0,0,0,0,0,0,0,0
A rule bound head butler's world of manners and decorum in the household he maintains is tested by the arrival of a housekeeper who falls in love with him in post-WWI Britain. The possibility of romance and his master's cultivation of ties with the Nazi cause challenge his carefully maintained veneer of servitude.,0,0,0,0,0,0,1,0,0,0,0,0,0,0,1,0,0,0,0
"Danny DeVito plays an advertising man who is slowly sliding downhill. When he is fired from his job in Detroit, he signs up for unemployment. One day they find him a job; Teaching thinking skills to Army recruits. He arrives on base to find that there is no structure set up for the class.",0,0,0,1,0,0,0,0,0,0,0,0,0,0,0,0,0,1,0
"When a prostitute is found dead in a Los Angeles skyscraper occupied by a large Japanese corporation, detectives John Conner and Web Smith are called in to investigate. Although Conner has previous experience working in Japan, cultural differences make their progress difficult until a security disc showing the murder turns up. Close scrutiny proves the disc has been doctored, and the detectives realize they're dealing with a cover-up as well.",1,0,0,0,0,0,1,0,0,0,0,0,0,0,0,0,1,0,0
"An unhappy young couple visit the infamous Kellogg spa in Battle Creek, Michigan while a young hustler tries get into the breakfast-cereal business and compete against John Kellogg's corn flakes.",0,0,0,1,0,0,0,0,0,0,0,0,0,0,1,0,0,0,0
"The mega corporation Omni Consumer Products is still bent on creating their pet project, Delta City, to replace the rotting city of Detroit. Unfortunately, the inhabitants of the area have no intention of abandoning their homes simply for desires of the company. To this end, OCP have decided to force them to leave by employing a ruthless mercenary army to attack and harass them. An underground resistance begins and in this fight, Robocop must decide where his loyalties lie.",1,1,0,0,1,0,0,0,0,0,0,0,0,0,0,1,1,0,0
"Robin Hood comes home after fighting in the Crusades to learn that the noble King Richard is in exile and that the despotic King John now rules England, with the help of the Sheriff of Rottingham. Robin Hood assembles a band of fellow patriots to do battle with King John and the Sheriff.",0,0,0,1,0,0,0,0,0,0,0,0,0,0,0,0,0,0,0
A corrupt cop gets in over his head when he tries to assassinate a beautiful Russian hit-woman.,1,0,0,0,1,0,1,0,0,0,0,0,0,0,0,0,1,0,0
"Nazi skinheads in Melbourne take out their anger on local Vietnamese, who are seen as threatening racial purity. Finally the Vietnamese have had enough and confront the skinheads in an all-out confrontation, sending the skinheads running. A woman who is prone to epileptic seizures joins the skins' merry band, and helps them on their run from justice, but is her affliction also a sign of impurity?",1,0,0,0,0,0,1,0,0,0,0,0,0,0,0,0,1,0,0
