overview,Action,Adventure,Animation,Comedy,Crime,Documentary,Drama,Family,Fantasy,Foreign,History,Horror,Music,Mystery,Romance,Science Fiction,Thriller,War,Western
"Convenience and video store clerks Dante and Randal are sharp-witted, potty-mouthed and bored out of their minds. So in between needling customers, the counter jockeys play hockey on the roof, visit a funeral home and deal with their love lives.",0,0,0,1,0,0,0,0,0,0,0,0,0,0,0,0,0,0,0
"John Arnold DeMarco is a man who believes he is Don Juan, the greatest lover in the world. Clad in a cape and mask, DeMarco undergoes psychiatric treatment with Dr. Jack Mickler to cure him of his apparent delusion. But the psychiatric sessions have an unexpected effect on the psychiatric staff and, most profoundly, Dr Mickler, who rekindles the romance in his complacent marriage.",0,0,0,1,0,0,1,0,0,0,0,0,0,0,1,0,0,0,0
"A computer specialist is sued for sexual harassment by a former lover turned boss who initiated the act forcefully, which threatens both his career and his personal life.",0,0,0,0,1,0,1,0,0,0,0,0,0,1,1,0,1,0,0
"Kris is a homicide cop with psychic abilities. She works to prove that the prime suspect in her latest case (the much younger husband of the millionaire victim) is innocent. But are her visions true, or planned by someone who knows what she can see?",0,0,0,0,0,0,0,0,0,0,0,0,0,0,0,0,1,0,0
A team of skydiving crooks led by DEA-agent-turned-bad Ty Moncrief (Busey) specialize in landing on police roofs and breaking in so their evil computer nerd can steal undercover agents' files and sell them to drug lords. Federal Marshal Pete Nessip (Snipes) lost a brother to this crew and learns skydiving with the help of tough-but-lovable instructor Jessie Crossmann (Butler) so he can track them down.,1,1,0,0,0,0,0,0,0,0,0,0,0,0,0,0,1,0,0
"Johnny Destiny burns into Las Vegas in his hot Plymouth RoadRunner, stopping only to pick up a stranger stranded in the desert. But then, things aren't always as they seem. Anything can happen in that town of many possibilities...especially since there's been some weird electrical disturbances. As the stranger, fresh out of prison, tries to put his life back together--to recover his money from an old bank heist and the girl he lost in doing the job--something keeps interfering with his plans. Is it fate...or just Destiny?",0,0,0,1,1,0,0,0,1,0,0,0,0,0,0,0,0,0,0
A political activist is convinced that her guest is a man who once tortured her for the government.,0,0,0,0,0,0,1,0,0,0,0,0,0,1,0,0,1,0,0
"Dolores Claiborne was accused of killing her abusive husband twenty years ago, but the court's findings were inconclusive and she was allowed to walk free. Now she has been accused of killing her employer, Vera Donovan, and this time there is a witness who can place her at the scene of the crime. Things look bad for Dolores when her daughter Selena, a successful Manhattan magazine writer, returns to cover the story.",0,0,0,0,1,0,1,0,0,0,0,0,0,1,0,0,0,0,0
"Lloyd and Harry are two men whose stupidity is really indescribable. When Mary, a beautiful woman, loses an important suitcase with money before she leaves for Aspen, the two friends (who have found the suitcase) decide to return it to her. After some ""adventures"" they finally get to Aspen where, using the lost money they live it up and fight for Mary's heart.",0,0,0,1,0,0,0,0,0,0,0,0,0,0,0,0,0,0,0
"The film tells the story of a retired and widowed Chinese master chef Chu (Si Hung Lung) and his family living in modern day Taipei, Taiwan. At the start of the film, he lives with his three attractive daughters, all of whom are unattached. As the film progresses, each of the daughters encounters new men in their lives. When these new relationships blossom, the stereotypes are broken and the living situation within the family changes.. The film features several scenes displaying the techniques and artistry of gourmet Chinese cooking. Since the family members have difficulty expressing their love for each other, the intricate preparation of banquet quality dishes for their Sunday dinners is the surrogate for their familial feelings.",0,0,0,1,0,0,1,0,0,0,0,0,0,0,1,0,0,0,0
"In the upscale Toronto strip club Exotica, dancer Christina is visited nightly by the obsessive Francis, a depressed tax auditor. Her ex-boyfriend, the club's MC, Eric, still jealously pines for her even as he introduces her onstage, but Eric is having his own relationship problems with the club's owner, Zoe. Meanwhile Thomas, a mysterious pet-shop owner, is about to become unexpectedly involved in their lives. Gradually, connections between the traumatic pasts of these characters are revealed.",0,0,0,0,0,0,1,0,0,0,0,0,0,1,0,0,0,0,0
"Elliot is going to the island of Eden to live out his submissive fantasies, but inadvertently photographs diamond smugglers at work. Smugglers, and detectives, follow him to the island, where they try to retrieve the film. Elliot begins falling in love with Lisa, the head mistress of the island, and Lisa must evaluate her feelings about Elliot and her own motivations.",0,0,0,1,1,0,0,0,0,0,0,0,0,0,1,0,1,0,0
"The mostly true story of the legendary ""worst director of all time"", who, with the help of his strange friends, filmed countless B-movies without ever becoming famous or successful.",0,0,0,1,0,0,1,0,0,0,1,0,0,0,0,0,0,0,0
French Kiss is director Kasdan’s best film since the Bodyguard. The plot involves a couple in love and one woman’s attempt to fly to Paris to get her lover back from a business trip and marry him. On the way she unknowingly smuggles something of value that has a petty thief chasing her across France as she chases after her future husband.,0,0,0,1,0,0,0,0,0,0,0,0,0,0,1,0,0,0,0
"Mickey Gordon is a basketball referee who travels to France to bury his father. Ellen Andrews is an American living in Paris who works for the airline he flies on. They meet and fall in love, but their relationship goes through many difficult patches. The story is told in flashback by their friends at a restaurant waiting for them to arrive.",0,0,0,1,0,0,1,0,0,0,0,0,0,0,1,0,0,0,0
"Teenager Angus adopts a stray dog and names him Yellow. Several days later, while travelling along the coast of British Columbia with Angus's father, John, the boy and dog become stranded when turbulent waters capsize their boat. Angus's parents relentlessly badger rescue teams. Angus, schooled by his father in wilderness survival skills, and assisted by the intelligent Yellow Dog, tries to attract rescuers.",1,1,0,0,0,0,1,1,0,0,0,0,0,0,0,0,0,0,0
"Though Goofy always means well, his amiable cluelessness and klutzy pratfalls regularly embarrass his awkward adolescent son, Max. When Max's lighthearted prank on his high-school principal finally gets his longtime crush, Roxanne, to notice him, he asks her on a date. Max's trouble at school convinces Goofy that he and the boy need to bond over a cross-country fishing trip like the one he took with his dad when he was Max's age, which throws a kink in his son's plans to impress Roxanne.",0,1,1,1,0,0,0,1,0,0,0,0,0,0,1,0,0,0,0
"Hatch Harrison, his wife, Lindsey, and their daughter, Regina, are enjoying a pleasant drive when a car crash leaves wife and daughter unharmed but kills Hatch. However, an ingenious doctor, Jonas Nyebern, manages to revive Hatch after two lifeless hours. But Hatch does not come back unchanged. He begins to suffer horrible visions of murder -- only to find out the visions are the sights of a serial killer.",0,0,0,0,0,0,1,0,0,0,0,0,0,0,0,0,1,0,0
"Workaholic Thomas Johnson dies in an auto accident and comes back to life as a dog. Remembering some of who he was, he returns to his wife and son to protect them from the man who caused his accident. But, as time goes by, he remembers more of his life, and realizes he wasn't such a good husband and father.",0,0,0,0,0,0,1,1,1,0,0,0,0,0,0,0,0,0,0
"Farinelli is a 1994 biopic film about the life and career of Italian opera singer Farinelli, considered one of the greatest castrato singers of all time.",0,0,0,0,0,0,1,0,0,0,1,0,0,0,0,0,0,0,0
A talking pig named Gordy becomes involved in a quest to save his family from the slaughterhouse.,0,0,0,0,0,0,1,1,1,0,0,0,0,0,0,0,0,0,0
"The band is back together! Gumby reunites with The Clayboys to perform at a concert benefiting local farmers. But things take an unexpected turn when Gumby s dog, Lowbelly, reacts to the music by crying tears of real pearl! Fortune turns into disaster as Gumby s archenemies, the Blockheads, devise an elaborate scheme to dognap Lowbelly and harvest her pearls for themselves. When the Blockheads initial plan fails, they kidnap The Clayboys as well...and replace them with clones! The battle between Clayboys and clones is filled with trains and planes, knights and fights, thrills and spills. True to classic Gumby adventures, Gumby: The Movie takes viewers in and out of books, to Toyland, Camelot, outer space and beyond!",0,0,1,0,0,0,0,1,1,0,0,0,0,0,0,1,0,0,0
"J.J. is a rookie in the Sheriff's Department and the first black officer at that station. Racial tensions run high in the department as some of J.J.'s fellow officers resent his presence. His only real friend is the other new trooper, the first female officer to work there, who also suffers similar discrimination in the otherwise all-white-male work environment. When J.J. becomes increasingly aware of police corruption during the murder trial of Teddy Woods, whom he helped to arrest, he faces difficult decisions and puts himself into grave personal danger in the service of justice.",1,0,0,0,1,0,1,0,0,0,0,0,0,0,0,0,1,0,0
"This documentary follows two inner-city Chicago residents, Arthur Agee and William Gates, as they follow their dreams of becoming basketball superstars. Beginning at the start of their high school years, and ending almost 5 years later, as they start college, we watch the boys mature into men, still retaining their ""Hoop Dreams"".",0,0,0,0,0,1,0,0,0,0,0,0,0,0,0,0,0,0,0
"Based on the true story of Juliet Hulme and Pauline Parker, two close friends who share a love of fantasy and literature, who conspire to kill Pauline's mother when she tries to end the girls' intense and obsessive relationship.",0,0,0,0,0,0,1,0,1,0,0,0,0,0,0,0,0,0,0
"In hot water with the mob over an unpaid debt, a con man poses as a family friend in an affluent Pennsylvania suburb.",0,0,0,1,0,0,0,1,0,0,0,0,0,0,0,0,0,0,0
"The life and death of the legendary Ludwig van Beethoven. Beside all the work he is known for, the composer once wrote a famous love letter to a nameless beloved and the movie tries to find out who this beloved was. Not easy as Beethoven has had many women in his life.",0,0,0,0,0,0,1,0,0,0,0,0,1,0,1,0,0,0,0
"Camp Hope is a summer retreat for overweight boys run by a kindly couple who make the campers feel comfortable with their extra pounds. But when tyrannical fitness guru Tony buys the camp, he puts the kids on a cruel regimen that goes too far. Sick of the endless weeks of ""all work and no play,"" the kids stage a coup and reclaim their summer of fun.",0,0,0,1,0,0,1,1,0,0,0,0,0,0,0,0,0,0,0
A businessman on a trip to Tokyo ends up in the middle of a centuries old feud between a criminal Ninja cult and a Samurai when he witnesses a assassination performed by the Ninja-cult leader.,1,0,0,0,0,0,0,0,0,0,0,0,0,0,0,0,1,0,0
Albert Einstein helps a young man who's in love with Einstein's niece to catch her attention by pretending temporarily to be a great physicist.,0,0,0,1,0,0,1,0,0,0,0,0,0,0,1,0,0,0,0
"A vampire relates his epic life story of love, betrayal, loneliness, and dark hunger to an over-curious reporter.",0,0,0,0,0,0,0,0,0,0,0,1,0,0,1,0,0,0,0
"His wife having recently died, Thomas Jefferson accepts the post of United States ambassador to pre-revolutionary France, though he finds it difficult to adjust to life in a country where the aristocracy subjugates an increasingly restless peasantry. In Paris, he becomes smitten with cultured artist Maria Cosway, but, when his daughter visits from Virginia accompanied by her attractive slave, Sally Hemings, Jefferson's attentions are diverted.",0,0,0,0,0,0,1,0,0,0,0,0,0,0,1,0,0,0,0
"When two unemployed telephone pranksters decide to use their vocal ""talents"" to impersonate a Chicago mob boss and curry favor with organized crime in New York, the trouble begins. It isn't long before Johnny and Kamal (the ""Jerky Boys"" of crank call fame) are wanted by the local mafia, the police, and their neighbor.",0,0,0,1,1,0,0,0,0,0,0,0,0,0,0,0,0,0,0
"As part of a fertility research project, a male scientist agrees to carry a pregnancy in his own body.",0,0,0,1,0,0,0,1,0,0,0,0,0,0,1,0,0,0,0
"Bobby Earl is facing the electric chair for the murder of a young girl. Eight years after the crime he calls in Paul Armstrong, a professor of law, to help prove his innocence. Armstrong quickly uncovers some overlooked evidence to present to the local police, but they aren't interested - Bobby was their killer.",1,0,0,0,0,0,1,0,0,0,0,0,0,1,0,0,1,0,0
"A Southern California kid named Calvin Fuller is magically transported to the medieval kingdom of Camelot through a crack in the ground caused by an earthquake. Once there, he learns he was summoned by the wizard Merlin, who needs Calvin to save Camelot. Using dazzling modern inventions, can Calvin help King Arthur retain his crown and thwart the evil Lord Belasco?",0,1,0,1,0,0,0,1,1,0,0,0,0,0,0,1,0,0,0
"Jimmy Kilmartin is an ex-con living in Astoria in the New York City borough of Queens, trying to stay clean and raising a family with his wife Bev. But when his cousin Ronnie causes him to take a fall for driving an illegal transport of stolen cars, a police officer named Calvin Hart is injured and Jimmy lands back in prison. In exchange for an early release, he is asked to help bring down a local crime boss named Little Junior Brown.  Jimmy remarries and attempts to renew a relationship with his child. But he is sent undercover by Detective Hart to work with Junior and infiltrate his operations. As soon as Little Junior kills an undercover federal agent with Jimmy watching, the unscrupulous district attorney and the feds further complicate his life. He must take down Junior or face the consequences.",1,0,0,0,1,0,1,0,0,0,0,0,0,0,0,0,1,0,0
Princess Leia is captured and held hostage by the evil Imperial forces in their effort to take over the galactic Empire. Venturesome Luke Skywalker and dashing captain Han Solo team together with the loveable robot duo R2-D2 and C-3PO to rescue the beautiful princess and restore peace and justice in the Empire.,1,1,0,0,0,0,0,0,0,0,0,0,0,0,0,1,0,0,0
"With their father away as a chaplain in the Civil War, Jo, Meg, Beth and Amy grow up with their mother in somewhat reduced circumstances. They are a close family who inevitably have their squabbles and tragedies. But the bond holds even when, later, male friends start to become a part of the household.",0,0,0,0,0,0,1,0,0,0,0,0,0,0,1,0,0,0,0
"When her father enlists to fight for the British in WWI, young Sara Crewe goes to New York to attend the same boarding school her late mother attended. She soon clashes with the severe headmistress, Miss Minchin, who attempts to stifle Sara's creativity and sense of self- worth.",0,0,0,0,0,0,1,1,1,0,0,0,0,0,0,0,0,0,0
"This Ken Loach docu-drama relates the story of a British woman's fight with Social Services over the care of her children. Maggie has a history of bouncing from one abusive relationship to another. She has four children, of four different fathers, who came to the attention of Social Services when they were injured in a fire. Subsequently, Maggie was found to be an ""unfit mother"" and her children were removed from her care. She finally meets the man of her dreams, a Paraguayan expatriate, and they start a family together. Unfortunately, Social Services seems unwilling to accept that her life has changed and rends them from their new children. She and Jorge together, and separately, fight Social Services, Immigration, and other government bureaucrats in a desperate battle to make their family whole again.",0,0,0,0,0,0,1,0,0,0,0,0,0,0,0,0,0,0,0
"Paul, an irritable and stressed-out hotel manager, begins to gradually develop paranoid delusions about his wife's infidelity...",0,0,0,0,1,0,1,0,0,0,0,0,0,0,0,0,0,0,0
"Tita is passionately in love with Pedro, but her controlling mother forbids her from marrying him. When Pedro marries her sister, Tita throws herself into her cooking and discovers she can transfer her emotions through the food she prepares, infecting all who eat it with her intense heartbreak.",0,0,0,0,0,0,1,0,0,0,0,0,0,0,1,0,0,0,0
"An epic tale of three brothers and their father living in the remote wilderness of 1900s USA and how their lives are affected by nature, history, war, and love.",0,1,0,0,0,0,1,0,0,0,0,0,0,0,1,0,0,1,0
"Major Benson Winifred Payne is being discharged from the Marines. Payne is a killin' machine, but the wars of the world are no longer fought on the battlefield. A career Marine, he has no idea what to do as a civilian, so his commander finds him a job - commanding officer of a local school's JROTC program, a bunch of ragtag losers with no hope.",0,1,0,1,0,0,0,1,0,0,0,0,0,0,0,0,0,0,0
"The film follows the personal relationship between a father and his two sons, one of whom is a hit-man for the Russian mafia in Brooklyn.",1,0,0,0,0,0,1,0,0,0,0,0,0,0,0,0,0,0,0
"Mousie and Sad Girl are childhood best friends in a contemporary Los Angeles poor Hispanic neighborhood. But when Sad Girl becomes pregnant by Mousie's boyfriend, a drug dealer named Ernesto, the two become bitter enemies. While their dispute escalates towards violence, the violence of the world around them soon also impacts their lives.",0,0,0,0,1,0,1,0,0,0,0,0,0,0,0,0,0,0,0
"Ex-football star Mike Gambril meets Terry McKay on a flight to Sydney, which is forced to land on a small atoll. They become romantic on board a ship sent to take them to a larger island. They agree to meet in New York three months later to see if the attraction is real. One shows up but the other doesn't. However, a chance meeting brings them together again.",0,0,0,0,0,0,1,0,0,0,0,0,0,0,1,0,0,0,0
"Khaila Richards, a crack-addicted single mother, accidentally leaves her baby in a dumpster while high and returns the next day in a panic to find he is missing. In reality, the baby has been adopted by a warm-hearted social worker, Margaret Lewin, and her husband, Charles. Years later, Khaila has gone through rehab and holds a steady job. After learning that her child is still alive, she challenges Margaret for the custody.",0,0,0,0,0,0,1,0,0,0,0,0,0,0,0,0,0,0,0
"Nicholas Hytner’s much awarded 1994 drama, based on Alan Bennett's West End play. George III's erratic behaviour leads to a plot in Parliament to have him declared insane and removed from the throne.",0,0,0,1,0,0,1,0,0,0,1,0,0,0,0,0,0,0,0
"Based on Mary Shelley's novel, ""Frankenstein"" tells the story of Victor Frankenstein, a promising young doctor who, devastated by the death of his mother during childbirth, becomes obsessed with bringing the dead back to life. His experiments lead to the creation of a monster, which Frankenstein has put together with the remains of corpses. It's not long before Frankenstein regrets his actions.",0,0,0,0,0,0,1,0,0,0,0,1,0,0,1,1,0,0,0
"Ben Archer is not happy. His mother, Sandy, has just met a man, and it looks like things are pretty serious. Driven by a fear of abandonment, Ben tries anything and everything to ruin the ""love bubble"" which surrounds his mom. However, after Ben and Jack's experiences in the Indian Guides, the two become much closer.",1,0,0,1,0,0,0,1,0,0,0,0,0,0,0,0,0,0,0
The events focus around a crisis hotline business on one crazy night during the Christmas holidays.,0,0,0,1,0,0,1,0,0,0,0,0,0,0,1,0,0,0,0
"Three young boys pool their money and pay V, a kindhearted prostitute, to strip for them. Afterward, she drives them home to the suburbs -- but then her car breaks down. It's just as well, though, because a mobster named Waltzer is after her, and V realizes the suburbs are the perfect place to hide. But things get a lot more complicated when V falls in love with Tom, a single father who is unaware of her real profession.",0,0,0,1,0,0,0,0,0,0,0,0,0,0,1,0,0,0,0
"A little girl discovers dreams can come true if you really believe. Six-year-old Susan Walker has doubts about childhood's most enduring miracle - Santa Claus. Her mother told her the 'secret' about Santa a long time ago. But after meeting a special department store Santa who's convinced he's the real thing, Susan is given the most precious gift of all something to believe in.",0,0,0,0,0,0,1,1,1,0,0,0,0,0,0,0,0,0,0
"Gwyn Marcus has always wanted a marriage like her parents. She has just accepted the proposal of her boyfriend Matt, but she has misgivings about their future together. Her fear of commitment grows as she learns of the various affairs that her family is having. With her sister getting married and her brother already married, her mother is growing concerned about Gwyn's being the last single person in the family. But the more she thinks about marriage, the more she must search for the balance between career, marriage and family.",0,0,0,1,0,0,0,0,0,0,0,0,0,0,1,0,0,0,0
"Traces over three generations an immigrant family's trials, tribulations, tragedies, and triumphs. Maria and Jose, the first generation, come to Los Angeles, meet, marry, face deportation all in the 1930's. They establish their family in East L.A., and their children Chucho, Paco, Memo, Irene, Toni, and Jimmy deal with youth culture and the L.A. police in the 50's. As the second generation become adults in the 60's, the focus shifts to Jimmy, his marriage to Isabel (a Salvadorian refugee), their son, and Jimmy's journey to becoming a responsible parent.",0,0,0,1,0,0,1,0,0,0,0,0,0,0,0,0,0,0,0
"Inspired by a true story. A petty criminal sent to Alcatraz in the 1930s is caught attempting to make an escape. As punishment he is put in solitary confinement. The maximum stay is supposed to be 19 days, but Henri spends years alone, cold and in complete darkness, only to emerge a madman and soon to be a murderer. The story follows a rookie lawyer attempting to prove that Alcatraz was to blame.",0,0,0,0,1,0,1,0,0,0,0,0,0,0,0,0,0,0,0
"Sully is a rascally ne'er-do-well approaching retirement age. While he is pressing a worker's compensation suit for a bad knee, he secretly works for his nemesis, Carl, and flirts with Carl's young wife Toby. Sully's long- forgotten son and family have moved back to town, so Sully faces unfamiliar family responsibilities. Meanwhile, Sully's landlady's banker son plots to push through a new development and evict Sully from his mother's life.",0,0,0,1,0,0,1,0,0,0,0,0,0,0,0,0,0,0,0
"In a remote woodland cabin, a small town doctor discovers Nell - a beautiful young hermit woman with many secrets.",0,0,0,0,0,0,1,0,0,0,0,0,0,0,0,0,1,0,0
"New Jersey Drive is a 1995 film about black youths in Newark, New Jersey, the unofficial ""car theft capital of the world"". Their favorite pastime is that of everybody in their neighborhood: stealing cars and joyriding. The trouble starts when they steal a police car and the cops launch a violent offensive that involves beating and even shooting suspects.",0,0,0,0,1,0,1,0,0,0,0,0,0,0,0,0,0,0,0
"Allegedly based on a true story, this film follows the life of Toshi, a Japanese man living in America and working with the New York City police. After being recommended for undercover work, Toshi decides to go after a gang lead by Hawk. Hawk and Toshi soon become friends, although Hawk's second-in-command, Tito, is suspicious of the newcomer. Will Toshi be able to bring the gang down, or will his cover be blown before he can finish the assignment?",1,0,0,0,1,0,1,0,0,0,0,0,0,0,0,0,1,0,0
An experiment gone awry places a neurologist (Elizabeth Hurley) and a homicide detective (Craig Fairbrass) in a psychopath's (Keith Allen) nightmarish world.,0,0,0,0,0,0,0,0,0,0,0,1,0,0,0,0,0,0,0
"It has been 73 years since Alex failed and the Humans lost the Cyborg Wars. Since then, the Humans have been enslaved. Scientists have developed a new DNA strain, which could signal the end of the Cyborgs, and they inject it into a volunteer. When the Cyborgs learn of the woman and the baby they list both for termination.",1,0,0,0,0,0,0,0,0,0,0,0,0,0,0,1,1,0,0
"Laura San Giacomo stars in this sexy comedy about adultery. When Nina's (San Giacomo) husband goes out of town for several weeks on a business trip, Nina hooks up with a photographer. Told from a reporter's point of view, his interviews with Nina and the photographer provide comic insights. Stars Laura San Giacomo, Paul Rhys, Michael O'Keefe, Fisher Stevens and more.",0,0,0,0,0,0,1,0,0,0,0,0,0,0,1,0,0,0,0
Two victims of traumatized childhoods become lovers and psychopathic serial murderers irresponsibly glorified by the mass media.,0,0,0,0,1,0,1,0,0,0,0,0,0,0,0,0,1,0,0
"A childhood incident has convinced Faith Corvatch that her true love is a guy named ""Damon Bradley,"" but she has yet to meet him. Preparing to settle down and marry a foot doctor, Faith impulsively flies to Venice when it seems that she may be able to finally encounter the man of her dreams. Instead, she meets the charming Peter Wright. But can they fall in love if she still believes that she is intended to be with someone else?",0,0,0,1,0,0,1,0,0,0,0,0,0,0,1,0,0,0,0
"A drama about a Maori family lving in Auckland, New Zealand. Lee Tamahori tells the story of Beth Heke’s strong will to keep her family together during times of unemployment and abuse from her violent and alcoholic husband.",0,0,0,0,0,0,1,0,0,0,0,0,0,0,0,0,0,0,0
